"Référence";"Contenu";"Objectif";"Thématique";"Cibles";"Correspondance";"Observations";"Référence ISO (1)";"Contenu ISO (1)";"Référence ISO (2)";"Contenu ISO (2)";"Référence ISO (3)";"Contenu ISO (3)";"Référence ISO (4)";"Contenu ISO (4)";"Référence ISO (5)";"Contenu ISO (5)";"Référence ISO (6)";"Contenu ISO (6)";"Référence ISO (7)";"Contenu ISO (7)"
"8.4-EE";"Lorsque des raisons techniques ou opérationnelles ne permettent pas la mise en œuvre d’une authentification multifacteur, l’entité met en œuvre des mesures permettant de réduire le risque associé.";"Objectif de sécurité 8: Sécurisation des accès distants aux systèmes d'information";"Sécurisation des accès distants";"EntiteEssentielle";"élevé";;"27001:2022-6.1.2 Appréciation des risques de sécurité de l'information";"6.1.2 Appréciation des risques de sécurité de l'information";"27001:2022-6.1.3 Traitement des risques de sécurité de l'information";"6.1.3 Traitement des risques de sécurité de l'information";"27001:2022-8.2 Appréciation des risques de sécurité de l'information";"8.2 Appréciation des risques de sécurité de l'information";"27001:2022-8.3 Traitement des risques de sécurité de l'information";"8.3 Traitement des risques de sécurité de l'information";;;;;;
"8.5-EE";"Les mémoires de masse (par exemple : les « disques ») des postes de travail et équipements mobiles permettant aux personnels et prestataires de l’entité d’accéder à distance aux systèmes d’information depuis un lieu qui n’est pas maîtrisé par l’entité, sont en permanence protégées par des mécanismes de chiffrement et d’authentification conformes à l’état de l’art tel que recommandé par l’autorité nationale de sécurité des systèmes d’information (par exemple : disques chiffrés avec code PIN exigé pour le déchiffrement au démarrage).";"Objectif de sécurité 8: Sécurisation des accès distants aux systèmes d'information";"Sécurisation des accès distants";"EntiteEssentielle";"moyen";"Les mesures prévues par la norme ISO 27002 en matière d'accès distants couvrent les accès distants des employés mais pas des prestataires qui accèderaient également à distance aux SI (par exemple : le cas de l'infogérance).";"27002:2022-7.9 Sécurité des actifs hors des locaux";"7.9 Sécurité des actifs hors des locaux";"27002:2022-8.1 Terminaux finaux des utilisateurs";"8.1 Terminaux finaux des utilisateurs";"27002:2022-8.24 Utilisation de la cryptographie";"8.24 Utilisation de la cryptographie";;;;;;;;
"9.1-EI/EE";"L’entité définit les ressources matérielles, en particulier les terminaux, autorisées à se connecter à ses systèmes d’information.
NB : Cette mesure autorise le AVEC (Apportez votre équipement de communication) ou BYOD en anglais.";"Objectif de sécurité 9: Protection des systèmes d'information contre les codes malveillants";"Protection contre les codes malveillants";"EntiteImportante, EntiteEssentielle";"élevé";;"27002:2022-7.9 Sécurité des actifs hors des locaux";"7.9 Sécurité des actifs hors des locaux";"27002:2022-8.1 Terminaux finaux des utilisateurs";"8.1 Terminaux finaux des utilisateurs";"27002:2022-8.3 Restrictions d'accès aux informations";"8.3 Restrictions d'accès aux informations";"27002:2022-8.7 Protection contre les programmes malveillants (malware)";"8.7 Protection contre les programmes malveillants (malware)";"27002:2022-8.20 Sécurité des réseaux";"8.20 Sécurité des réseaux";;;;
"9.2-EE";"Seules les ressources matérielles dont l’entité, ou le prestataire qu’elle a mandaté à cet effet, assure la gestion et qui participent à la réalisation des activités ou des services de l’entité ou au maintien en condition opérationnelle et de sécurité se connectent aux systèmes d’information.
NB : Cette mesure interdit le AVEC (Apportez votre équipement de communication) ou BYOD en anglais.";"Objectif de sécurité 9: Protection des systèmes d'information contre les codes malveillants";"Protection contre les codes malveillants";"EntiteEssentielle";"moyen";"Alors que la norme ISO 27002 laisse à l'organisation la responsabilité de définir les pratiques en matière d'AVEC / BYOD, la mesure du référentiel NIS 2 l'exclue explicitement pour les entités essentielles";"27002:2022-8.1 Terminaux finaux des utilisateurs";"8.1 Terminaux finaux des utilisateurs";"27002:2022-8.3 Restrictions d'accès aux informations";"8.3 Restrictions d'accès aux informations";"27002:2022-8.7 Protection contre les programmes malveillants (malware)";"8.7 Protection contre les programmes malveillants (malware)";"27002:2022-8.20 Sécurité des réseaux";"8.20 Sécurité des réseaux";;;;;;
"9.3-EI/EE";"L’entité met en œuvre des mesures organisationnelles ou techniques visant à empêcher la connexion des ressources matérielles autres que celles identifiées à la mesure 9.1-EI/EE sur ses systèmes d’information.";"Objectif de sécurité 9: Protection des systèmes d'information contre les codes malveillants";"Protection contre les codes malveillants";"EntiteImportante, EntiteEssentielle";"élevé";;"27002:2022-5.10 Utilisation correcte des informations et autres actifs associés";"5.10 Utilisation correcte des informations et autres actifs associés";"27002:2022-6.2 Termes et conditions du contrat de travail";"6.2 Termes et conditions du contrat de travail";"27002:2022-6.3 Sensibilisation, enseignement et formation en sécurité de l'information";"6.3 Sensibilisation, enseignement et formation en sécurité de l'information";"27002:2022-8.7 Protection contre les programmes malveillants (malware)";"8.7 Protection contre les programmes malveillants (malware)";"27002:2022-8.20 Sécurité des réseaux";"8.20 Sécurité des réseaux";"27002:2022-8.21 Sécurité des services réseau";"8.21 Sécurité des services réseau";"27002:2022-8.27 Principes d'ingénierie et d'architecture des système sécurisés";"8.27 Principes d'ingénierie et d'architecture des système sécurisés"
"9.4-EE";"L’entité met en œuvre des mesures organisationnelles ou techniques visant à empêcher la connexion des ressources matérielles autres que celles identifiées à la mesure 9.2-EE sur ses systèmes d’information.";"Objectif de sécurité 9: Protection des systèmes d'information contre les codes malveillants";"Protection contre les codes malveillants";"EntiteEssentielle";"élevé";;"27002:2022-5.10 Utilisation correcte des informations et autres actifs associés";"5.10 Utilisation correcte des informations et autres actifs associés";"27002:2022-6.2 Termes et conditions du contrat de travail";"6.2 Termes et conditions du contrat de travail";"27002:2022-6.3 Sensibilisation, enseignement et formation en sécurité de l'information";"6.3 Sensibilisation, enseignement et formation en sécurité de l'information";"27002:2022-8.7 Protection contre les programmes malveillants (malware)";"8.7 Protection contre les programmes malveillants (malware)";"27002:2022-8.20 Sécurité des réseaux";"8.20 Sécurité des réseaux";"27002:2022-8.21 Sécurité des services réseau";"8.21 Sécurité des services réseau";"27002:2022-8.27 Principes d'ingénierie et d'architecture des système sécurisés";"8.27 Principes d'ingénierie et d'architecture des système sécurisés"
"9.5-EI/EE";"Seuls les supports amovibles réinscriptibles nécessaires à la réalisation des activités et services de l’entité ou au maintien en condition opérationnelle ou de sécurité se connectent à ses systèmes d’information (par exemple : clefs USB ou disques dur amovibles).";"Objectif de sécurité 9: Protection des systèmes d'information contre les codes malveillants";"Protection contre les codes malveillants";"EntiteImportante, EntiteEssentielle";"élevé";;"27002:2022-5.10 Utilisation correcte des informations et autres actifs associés";"5.10 Utilisation correcte des informations et autres actifs associés";"27002:2022-6.2 Termes et conditions du contrat de travail";"6.2 Termes et conditions du contrat de travail";"27002:2022-6.3 Sensibilisation, enseignement et formation en sécurité de l'information";"6.3 Sensibilisation, enseignement et formation en sécurité de l'information";"27002:2022-7.10 Supports de stockage";"7.10 Supports de stockage";"27002:2022-8.7 Protection contre les programmes malveillants (malware)";"8.7 Protection contre les programmes malveillants (malware)";"27002:2022-8.21 Sécurité des services réseau";"8.21 Sécurité des services réseau";"27002:2022-8.27 Principes d'ingénierie et d'architecture des système sécurisés";"8.27 Principes d'ingénierie et d'architecture des système sécurisés"
"9.6-EI/EE";"Les postes de travail, les serveurs et les équipements mobiles maîtrisés par l’entité, qui sont amenés à traiter de données provenant de sources externes (par exemple les supports amovibles, la messagerie ou la navigation web), à l’exception de données de mise à jour fournies par les éditeurs et dont l’authenticité et l’intégrité sont vérifiées, disposent de mécanismes de protection contre les risques d'exécution de codes malveillants (par exemple : un antivirus ou un EDR).";"Objectif de sécurité 9: Protection des systèmes d'information contre les codes malveillants";"Protection contre les codes malveillants";"EntiteImportante, EntiteEssentielle";"élevé";;"27002:2022-8.7 Protection contre les programmes malveillants (malware)";"8.7 Protection contre les programmes malveillants (malware)";;;;;;;;;;;;
"9.7-EI/EE";"L’entité procède à l’analyse des données provenant de sources externes lors de leur réception, pour y rechercher des codes malveillants, à l’exception de données de mise à jour fournies par les éditeurs et dont l’authenticité et l’intégrité sont vérifiées (par exemple : une passerelle mail analysant les pièces jointes avant distribution, un SAS de décontamination antivirale pour les clefs USB).";"Objectif de sécurité 9: Protection des systèmes d'information contre les codes malveillants";"Protection contre les codes malveillants";"EntiteImportante, EntiteEssentielle";"élevé";;"27002:2022-8.7 Protection contre les programmes malveillants (malware)";"8.7 Protection contre les programmes malveillants (malware)";;;;;;;;;;;;
"10.A.1-EI/EE";"Les utilisateurs et les processus automatiques accédant aux ressources des systèmes d’information de l’entité disposent de comptes individuels. Les utilisateurs peuvent, le cas échéant, disposer de plusieurs comptes individuels.";"Objectif de sécurité 10: Gestion des identités et des accès des utilisateurs aux systèmes d'information";"Identification";"EntiteImportante, EntiteEssentielle";"élevé";"Alors que la norme ISO 27002 utilise la notion d'""identité"", le référentiel NIS 2 utilise la notion de ""compte"".";"27002:2022-5.16 Gestion des identités";"5.16 Gestion des identités";;;;;;;;;;;;
"10.A.2-EI/EE";"L’emploi d’un compte individuel du système d’information est réservé à l’utilisateur ou au processus automatique auquel ce compte a été attribué.";"Objectif de sécurité 10: Gestion des identités et des accès des utilisateurs aux systèmes d'information";"Identification";"EntiteImportante, EntiteEssentielle";"élevé";"Alors que la norme ISO 27002 utilise la notion d'""identité"", le référentiel NIS 2 utilise la notion de ""compte"".";"27002:2022-5.16 Gestion des identités";"5.16 Gestion des identités";;;;;;;;;;;;
"10.A.3-EI/EE";"Lorsque des raisons techniques ou opérationnelles ne permettent pas de créer de comptes individuels pour les utilisateurs ou pour les processus automatiques, l’entité met en place des mesures permettant de réduire le risque lié à l'utilisation de comptes partagés et d'assurer la traçabilité de l'utilisation de ces comptes (par exemple : carnet de quart dans une salle de supervision, badgeuse à l’entrée de la salle).";"Objectif de sécurité 10: Gestion des identités et des accès des utilisateurs aux systèmes d'information";"Identification";"EntiteImportante, EntiteEssentielle";"élevé";;"27001:2022-6.1.2 Appréciation des risques de sécurité de l'information";"6.1.2 Appréciation des risques de sécurité de l'information";"27001:2022-6.1.3 Traitement des risques de sécurité de l'information";"6.1.3 Traitement des risques de sécurité de l'information";"27001:2022-8.2 Appréciation des risques de sécurité de l'information";"8.2 Appréciation des risques de sécurité de l'information";"27001:2022-8.3 Traitement des risques de sécurité de l'information";"8.3 Traitement des risques de sécurité de l'information";;;;;;
"10.A.4-EI/EE";"Lorsqu'un système d’information est utilisé pour diffuser de l'information au public, l’entité n'est pas tenue de créer de comptes pour l'accès du public à cette information (par exemple : l’accès à un site vitrine ne nécessite pas d’authentifier les visiteurs alors que l’accès à l’intranet doit authentifier les utilisateurs).";"Objectif de sécurité 10: Gestion des identités et des accès des utilisateurs aux systèmes d'information";"Identification";"EntiteImportante, EntiteEssentielle";"faible";"La norme ISO 27002 prévoit de nombreuses mesures sur la gestion des identités et des accès mais ne rentre pas dans le détail de la mesure du référentiel visant à exempter les entités de créer des comptes pour les systèmes d'information utilisés pour publier de l'information.";;;;;;;;;;;;;;
"10.A.5-EI/EE";"L’entité désactive les comptes qui ne sont plus nécessaires dans les délais prévus par sa politique de gestion des comptes (par exemple : sous 7 jours).";"Objectif de sécurité 10: Gestion des identités et des accès des utilisateurs aux systèmes d'information";"Identification";"EntiteImportante, EntiteEssentielle";"élevé";"La norme ISO 27002 prévoit plusieurs mesures sur la gestion du cycle de vie des identités mais n'appelle pas les organisations à définir un délai précis de désactivation, elle les invite à le faire ""rapidement"".";"27002:2022-5.16 Gestion des identités";"5.16 Gestion des identités";;;;;;;;;;;;
"10.A.6-EI/EE";"L’entité effectue périodiquement, au moins annuellement, une revue des comptes. Cette revue doit notamment vérifier le respect des présentes mesures relatives à l'identification et, le cas échéant, corriger les anomalies.";"Objectif de sécurité 10: Gestion des identités et des accès des utilisateurs aux systèmes d'information";"Identification";"EntiteImportante, EntiteEssentielle";"moyen";"La norme ISO 27002 prévoit de nombreuses mesures visant à évaluer l'efficacité des mesures de gestion des risques mais ne prévoit pas explicitement la revue périodique des comptes.";"27002:2022-5.16 Gestion des identités";"5.16 Gestion des identités";;;;;;;;;;;;
"10.B.1-EI/EE";"L’entité protège les accès des utilisateurs et processus automatiques aux ressources de ses systèmes d’information au moyen d'un mécanisme d'authentification impliquant au moins un élément secret (par exemple : un mécanisme d’authentification mono-facteur tel qu’un mot de passe, ou multi-facteur, tel qu’une carte à puce avec code PIN).";"Objectif de sécurité 10: Gestion des identités et des accès des utilisateurs aux systèmes d'information";"Authentification";"EntiteImportante, EntiteEssentielle";"élevé";;"27002:2022-5.17 Informations d'authentification";"5.17 Informations d'authentification";"27002:2022-8.5 Authentification sécurisée";"8.5 Authentification sécurisée";;;;;;;;;;
"10.B.2-EI/EE";"L’entité change les éléments secrets configurés par défaut, avant la mise en service d’une ressource. À cet effet, l’entité s'assure auprès du fabricant ou du fournisseur de la ressource qu'elle dispose des moyens et des droits permettant d’effectuer ces changements.";"Objectif de sécurité 10: Gestion des identités et des accès des utilisateurs aux systèmes d'information";"Authentification";"EntiteImportante, EntiteEssentielle";"élevé";;"27002:2022-5.17 Informations d'authentification";"5.17 Informations d'authentification";"27002:2022-8.5 Authentification sécurisée";"8.5 Authentification sécurisée";;;;;;;;;;
"10.B.3-EI/EE";"L’élément secret d'un compte partagé est renouvelé à chaque retrait d'un utilisateur de ce compte.";"Objectif de sécurité 10: Gestion des identités et des accès des utilisateurs aux systèmes d'information";"Authentification";"EntiteImportante, EntiteEssentielle";"élevé";;"27002:2022-5.17 Informations d'authentification";"5.17 Informations d'authentification";"27002:2022-8.5 Authentification sécurisée";"8.5 Authentification sécurisée";;;;;;;;;;
"10.B.4-EI/EE";"L’élément secret d’un compte n’est connu, que des utilisateurs autorisés à utiliser le compte (par exemple : les mots de passe des comptes partagés peuvent être stockés dans un coffre-fort de mots de passe).";"Objectif de sécurité 10: Gestion des identités et des accès des utilisateurs aux systèmes d'information";"Authentification";"EntiteImportante, EntiteEssentielle";"élevé";;"27002:2022-5.17 Informations d'authentification";"5.17 Informations d'authentification";"27002:2022-8.5 Authentification sécurisée";"8.5 Authentification sécurisée";;;;;;;;;;
"10.B.5-EI/EE";"Les facteurs d’authentification sont conformes aux recommandations de l’autorité nationale de sécurité des systèmes d’information en matière de complexité, en tenant compte du niveau de complexité maximal permis par la ressource concernée, et en matière de fréquence de renouvellement.";"Objectif de sécurité 10: Gestion des identités et des accès des utilisateurs aux systèmes d'information";"Authentification";"EntiteImportante, EntiteEssentielle";"élevé";"La norme ISO 27002 prévoit des mesures de sécurisation des facteurs d'authentification, le référentiel NIS 2 va au-delà en prévoyant que les mécanismes d'authentification mis en œuvre respectent les recommandations de l'ANSSI.";"27002:2022-5.17 Informations d'authentification";"5.17 Informations d'authentification";"27002:2022-8.5 Authentification sécurisée";"8.5 Authentification sécurisée";;;;;;;;;;
"10.B.6-EI/EE";"Lorsque des raisons techniques ou opérationnelles ne permettent pas de modifier l'élément secret, l’entité met en œuvre un contrôle d'accès approprié à la ressource concernée ainsi que des mesures de réduction du risque lié à l'utilisation d'un élément secret d'authentification fixe.";"Objectif de sécurité 10: Gestion des identités et des accès des utilisateurs aux systèmes d'information";"Authentification";"EntiteImportante, EntiteEssentielle";"élevé";;"27001:2022-6.1.2 Appréciation des risques de sécurité de l'information";"6.1.2 Appréciation des risques de sécurité de l'information";"27001:2022-6.1.3 Traitement des risques de sécurité de l'information";"6.1.3 Traitement des risques de sécurité de l'information";"27001:2022-8.2 Appréciation des risques de sécurité de l'information";"8.2 Appréciation des risques de sécurité de l'information";"27001:2022-8.3 Traitement des risques de sécurité de l'information";"8.3 Traitement des risques de sécurité de l'information";;;;;;
"10.B.7-EE";"Dans le cadre de cette exception, l’entité met également en œuvre des mesures de sécurité permettant d'assurer la traçabilité des accès.";"Objectif de sécurité 10: Gestion des identités et des accès des utilisateurs aux systèmes d'information";"Authentification";"EntiteEssentielle";"élevé";;"27002:2022-8.5 Authentification sécurisée";"8.5 Authentification sécurisée";;;;;;;;;;;;
"10.C.1-EI/EE";"L’entité n’attribue des droits qu’aux utilisateurs et processus automatiques authentifiés.";"Objectif de sécurité 10: Gestion des identités et des accès des utilisateurs aux systèmes d'information";"Droits d'accès";"EntiteImportante, EntiteEssentielle";"élevé";;"27002:2022-5.15 Contrôle d'accès";"5.15 Contrôle d'accès";"27002:2022-5.18 Droits d'accès";"5.18 Droits d'accès";"27002:2022-8.3 Restrictions d'accès aux informations";"8.3 Restrictions d'accès aux informations";"27002:2022-8.18 Utilisation de programmes utilitaires à privilèges";"8.18 Utilisation de programmes utilitaires à privilèges";;;;;;
"10.C.2-EI/EE";"Pour chaque utilisateur ou chaque processus automatique, l’entité n'attribue les droits d'accès qu’aux seules ressources nécessaires à la réalisation des activités et services de l’entité ou au maintien en condition opérationnelle ou de sécurité.";"Objectif de sécurité 10: Gestion des identités et des accès des utilisateurs aux systèmes d'information";"Droits d'accès";"EntiteImportante, EntiteEssentielle";"élevé";;"27002:2022-5.15 Contrôle d'accès";"5.15 Contrôle d'accès";"27002:2022-5.18 Droits d'accès";"5.18 Droits d'accès";"27002:2022-8.3 Restrictions d'accès aux informations";"8.3 Restrictions d'accès aux informations";"27002:2022-8.18 Utilisation de programmes utilitaires à privilèges";"8.18 Utilisation de programmes utilitaires à privilèges";;;;;;
"10.C.3-EI/EE";"Pour chaque ressource du système d’information, l’entité n’attribue les droits d’accès qu’aux seuls utilisateurs et processus automatiques justifiant d’un besoin au regard de leurs missions.";"Objectif de sécurité 10: Gestion des identités et des accès des utilisateurs aux systèmes d'information";"Droits d'accès";"EntiteImportante, EntiteEssentielle";"élevé";;"27002:2022-5.15 Contrôle d'accès";"5.15 Contrôle d'accès";"27002:2022-5.18 Droits d'accès";"5.18 Droits d'accès";"27002:2022-8.3 Restrictions d'accès aux informations";"8.3 Restrictions d'accès aux informations";"27002:2022-8.18 Utilisation de programmes utilitaires à privilèges";"8.18 Utilisation de programmes utilitaires à privilèges";;;;;;
"10.C.4-EI/EE";"L’entité effectue périodiquement, au moins annuellement, une revue des droits d’accès. Cette revue doit notamment vérifier le respect des présentes mesures relatives au droit d’accès et, le cas échéant, corriger les anomalies.";"Objectif de sécurité 10: Gestion des identités et des accès des utilisateurs aux systèmes d'information";"Droits d'accès";"EntiteImportante, EntiteEssentielle";"élevé";;"27002:2022-5.18 Droits d'accès";"5.18 Droits d'accès";"27002:2022-8.18 Utilisation de programmes utilitaires à privilèges";"8.18 Utilisation de programmes utilitaires à privilèges";;;;;;;;;;
"11.A.1-EI/EE";"Les actions d'administration sont effectuées exclusivement à partir de comptes d'administration et les comptes d'administration sont utilisés exclusivement pour les actions d'administration.
Par exemple : le compte d’administration d’un poste utilisateur est utilisé exclusivement pour l’administration de ce poste. L’utilisateur de ce poste dispose d’un compte bureautique non administrateur pour son utilisation quotidienne.";"Objectif de sécurité 11: Maitrise de l'administration des systèmes d'information";"Comptes d'administration";"EntiteImportante, EntiteEssentielle";"élevé";;"27002:2022-5.3 Séparation des tâches";"5.3 Séparation des tâches";"27002:2022-8.2 Droits d'accès privilégiés";"8.2 Droits d'accès privilégiés";"27002:2022-8.18 Utilisation de programmes utilitaires à privilèges";"8.18 Utilisation de programmes utilitaires à privilèges";;;;;;;;
"11.A.2-EI/EE";"Les comptes d’administration ne sont utilisés que par des administrateurs ou des personnes autorisées.";"Objectif de sécurité 11: Maitrise de l'administration des systèmes d'information";"Comptes d'administration";"EntiteImportante, EntiteEssentielle";"élevé";;"27002:2022-5.3 Séparation des tâches";"5.3 Séparation des tâches";"27002:2022-8.2 Droits d'accès privilégiés";"8.2 Droits d'accès privilégiés";"27002:2022-8.18 Utilisation de programmes utilitaires à privilèges";"8.18 Utilisation de programmes utilitaires à privilèges";;;;;;;;
"11.A.3-EI/EE";"Les comptes d’administration respectent les mesures relatives à la gestion des identités et des accès des utilisateurs aux systèmes d’information.";"Objectif de sécurité 11: Maitrise de l'administration des systèmes d'information";"Comptes d'administration";"EntiteImportante, EntiteEssentielle";"élevé";;"27002:2022-8.2 Droits d'accès privilégiés";"8.2 Droits d'accès privilégiés";"27002:2022-8.18 Utilisation de programmes utilitaires à privilèges";"8.18 Utilisation de programmes utilitaires à privilèges";;;;;;;;;;
"11.A.4-EE";"Un compte d'administration est utilisé exclusivement pour se connecter aux ressources que ce compte administre pour effectuer des actions d’administration, ou à une ressource d’administration (par exemple : le compte administrateur d’un routeur est utilisé depuis un poste d’administration ou sur le routeur pour l’administrer).";"Objectif de sécurité 11: Maitrise de l'administration des systèmes d'information";"Comptes d'administration";"EntiteEssentielle";"moyen";"La norme ISO 27002 prévoit de nombreuses mesures sur les accès à privilège mais ne sanctuarise pas les comptes d'administration à la seule réalisation des tâches d'administration.";"27002:2022-8.2 Droits d'accès privilégiés";"8.2 Droits d'accès privilégiés";"27002:2022-8.18 Utilisation de programmes utilitaires à privilèges";"8.18 Utilisation de programmes utilitaires à privilèges";;;;;;;;;;
