"Référence";"Contenu";"Objectif";"Thématique";"Cibles";"Correspondance";"Observations";"Référence ISO (1)";"Contenu ISO (1)";"Référence ISO (2)";"Contenu ISO (2)";"Référence ISO (3)";"Contenu ISO (3)";"Référence ISO (4)";"Contenu ISO (4)";"Référence ISO (5)";"Contenu ISO (5)";"Référence ISO (6)";"Contenu ISO (6)";"Référence ISO (7)";"Contenu ISO (7)"
"1.1-EI/EE";"L’entité liste l’ensemble de ses activités et services, y compris les activités et services qui ne correspondent pas aux critères pour lesquels l’entité constitue une entité importante ou essentielle (par exemple : une entité essentielle au titre d’une activité exploitation d’un oléoduc doit lister, en plus des activités et services participant à l’exploitation de l’oléoduc, tous les services et les autres activités qu’elle fournit).
Pour chaque entrée de cette liste, l’entité :
•	identifie un responsable de l’activité ou du service (par exemple le chef de service auquel est rattachée l'activité ou le service, un directeur métier, la direction générale) ;
•	liste les systèmes d’information les supportant.";"Objectif de sécurité 1: Recensement des systèmes d'information";"Recensement des SI";"EntiteImportante, EntiteEssentielle";"élevé";;"27002:2022-5.9 Inventaire des informations et autres actifs associés";"5.9 Inventaire des informations et autres actifs associés";"27002:2022-5.30 Préparation des TIC pour la continuité d'activité";"5.30 Préparation des TIC pour la continuité d'activité";;;;;;;;;;
"1.2-EI/EE";"L’entité précise dans la liste prévue au 1.1-EI/EE les systèmes d’information qui ne sont exposés à aucun des risques mentionnés à l’alinéa 2 de l’objectif de sécurité.
L’entité renseigne les justifications de ces choix.";"Objectif de sécurité 1: Recensement des systèmes d'information";"Recensement des SI";"EntiteImportante, EntiteEssentielle";"faible";"Cette mesure est une spécificité de la transposition nationale de la directive NIS 2 pour répondre au principe de proportionnalité inscrit dans la directive.";;;;;;;;;;;;;;
"1.3-EI/EE";"L’entité valide et réexamine annuellement la liste prévue au 1.1-EI/EE, et en tant que de besoin, notamment en cas d’évolution des activités et services de l’entité ou en cas de mise en service d’un nouveau système d’information.";"Objectif de sécurité 1: Recensement des systèmes d'information";"Recensement des SI";"EntiteImportante, EntiteEssentielle";"faible";"Cette mesure est une spécificité de la transposition nationale de la directive NIS 2 pour répondre au principe de proportionnalité inscrit dans la directive.";;;;;;;;;;;;;;
"2.A.1-EI/EE";"Le dirigeant exécutif de l’entité est responsable de la sécurité numérique au sein de son entité et en particulier du suivi de la conformité des systèmes d’information aux présentes mesures.";"Objectif de sécurité 2: Mise en œuvre d'un cadre de gouvernance de la sécurité numérique";"Rôles et responsabilités";"EntiteImportante, EntiteEssentielle";"élevé";"La norme ISO 27001 ne fait pas porter explicitement la responsabilité de la sécurité numérique à la direction.";"27001:2022-5.1 Leadership et engagement";"5.1 Leadership et engagement";"27002:2022-5.4 Responsabilités de la direction";"5.4 Responsabilités de la direction";"27002:2022-5.31 Exigences légales, statutaires, réglementaires et contractuelles";"5.31 Exigences légales, statutaires, réglementaires et contractuelles";;;;;;;;
"2.A.2-EE";"Il désigne au moins une personne qui le conseille et l’accompagne dans l’exercice de cette responsabilité. Cette personne est le point de contact privilégié de l’Agence nationale de la sécurité des systèmes d’information pour tous les sujets relatifs à la sécurité numérique (notamment incidents de sécurité, communications de l’ANSSI sur les sujets relatifs aux entités essentielles)";"Objectif de sécurité 2: Mise en œuvre d'un cadre de gouvernance de la sécurité numérique";"Rôles et responsabilités";"EntiteEssentielle";"élevé";"La norme ISO 27001 ne donne pas de détail et laisse à l'entité le soin de définir l'organisation de la sécurité numérique la plus adaptée. Le référentiel NIS 2, lui, invite le dirigeant exécutif à s'entourer, au minimum, d'une personne pour le conseiller sur les sujets de sécurité numérique et qui sera le point de contact privilégié de l'ANSSI.";"27001:2022-5.3 Rôles, responsabilités et autorités au sein de l'organisation";"5.3 Rôles, responsabilités et autorités au sein de l'organisation";"27002:2022-5.2 Fonctions et responsabilités liées à la sécurité de l'information";"5.2 Fonctions et responsabilités liées à la sécurité de l'information";"27002:2022-5.5 Contacts avec les autorités";"5.5 Contacts avec les autorités";;;;;;;;
"2.A.3-EI/EE";"L’entité définit et met en œuvre une organisation adaptée pour assurer sa sécurité numérique (par exemple : la désignation d’un responsable de la sécurité numérique, l’établissement d’un RACI, la mise en place d’une comitologie).";"Objectif de sécurité 2: Mise en œuvre d'un cadre de gouvernance de la sécurité numérique";"Rôles et responsabilités";"EntiteImportante, EntiteEssentielle";"élevé";;"27001:2022-5.3 Rôles, responsabilités et autorités au sein de l'organisation";"5.3 Rôles, responsabilités et autorités au sein de l'organisation";"27002:2022-5.2 Fonctions et responsabilités liées à la sécurité de l'information";"5.2 Fonctions et responsabilités liées à la sécurité de l'information";;;;;;;;;;
"2.B.1-EI/EE";"L’entité définit et met en œuvre une politique de sécurité des systèmes d’information (PSSI).";"Objectif de sécurité 2: Mise en œuvre d'un cadre de gouvernance de la sécurité numérique";"Politique de sécurité des systèmes d'information";"EntiteImportante, EntiteEssentielle";"élevé";;"27001:2022-5.1 Leadership et engagement";"5.1 Leadership et engagement";"27001:2022-5.2 Politique";"5.2 Politique";"27002:2022-5.1 Politiques de sécurité de l'information";"5.1 Politiques de sécurité de l'information";;;;;;;;
"2.B.2-EI/EE";"Cette PSSI comprend au moins :
•	L’organisation de la gouvernance de la sécurité numérique et notamment les rôles et les responsabilités du personnel interne et externe (par exemple : prestataires, fournisseurs) ;
•	Les orientations et objectifs stratégiques en matière de sécurité numérique déclinés de la stratégie globale de l’entité ;
•	L’engagement du dirigeant exécutif de l’entité à assurer la sécurité numérique des systèmes d’information dont il est responsable ;
•	L’engagement du dirigeant exécutif de l’entité à respecter les exigences légales et réglementaires et en particulier celles définies dans la transposition nationale de la directive NIS 2.
•	La PSSI tient également compte des exigences, procédures et spécificités propres au(x) secteur(s) dans lesquels l’entité exerce ses activités.";"Objectif de sécurité 2: Mise en œuvre d'un cadre de gouvernance de la sécurité numérique";"Politique de sécurité des systèmes d'information";"EntiteImportante, EntiteEssentielle";"élevé";;"27001:2022-5.1 Leadership et engagement";"5.1 Leadership et engagement";"27001:2022-5.2 Politique";"5.2 Politique";"27002:2022-5.1 Politiques de sécurité de l'information";"5.1 Politiques de sécurité de l'information";;;;;;;;
"2.B.3-EI/EE";"Le dirigeant exécutif de l’entité approuve la PSSI.";"Objectif de sécurité 2: Mise en œuvre d'un cadre de gouvernance de la sécurité numérique";"Politique de sécurité des systèmes d'information";"EntiteImportante, EntiteEssentielle";"élevé";;"27001:2022-5.1 Leadership et engagement";"5.1 Leadership et engagement";"27001:2022-5.2 Politique";"5.2 Politique";"27002:2022-5.1 Politiques de sécurité de l'information";"5.1 Politiques de sécurité de l'information";;;;;;;;
"2.B.4-EI/EE";"La PSSI est au minimum revue annuellement et mise à jour lorsque nécessaire, notamment en cas d’évolutions majeures de la menace, du contexte métier, technique ou organisationnel intervenues après son approbation.";"Objectif de sécurité 2: Mise en œuvre d'un cadre de gouvernance de la sécurité numérique";"Politique de sécurité des systèmes d'information";"EntiteImportante, EntiteEssentielle";"élevé";"La norme ISO 27001 ne précise pas la fréquence de révision de la PSSI alors que le référentiel NIS 2 appelle les organisations à s'interroger au moins annuellement sur la nécessité de revoir cette politique.";"27002:2022-5.1 Politiques de sécurité de l'information";"5.1 Politiques de sécurité de l'information";;;;;;;;;;;;
"2.B.5-EI/EE";"L’entité décline, en tant que de besoin, la PSSI en politiques de sécurité relatives à des thèmes précis permettant de couvrir tout ou partie des présentes mesures.
En particulier, l’entité définit et met en œuvre, au minimum, des politiques de sécurité en matière :
•	D’usage du chiffrement ;
•	De contrôle d’accès physique et logique ;
•	De revue de l’application des mesures de sécurité mises en œuvre ;
•	De gestion des comptes.";"Objectif de sécurité 2: Mise en œuvre d'un cadre de gouvernance de la sécurité numérique";"Politique de sécurité des systèmes d'information";"EntiteImportante, EntiteEssentielle";"élevé";;"27002:2022-5.1 Politiques de sécurité de l'information";"5.1 Politiques de sécurité de l'information";;;;;;;;;;;;
"2.C.1-EI/EE";"Pour chaque système d’information, l’entité réalise et maintient à jour une analyse de la conformité du système d’information vis-à-vis des mesures du présent référentiel.
L’analyse de la conformité identifie les éventuels écarts entre les mesures mises en œuvre par l’entité et les mesures prévues dans le présent référentiel.
Cette analyse tient compte de la PSSI de l’entité.";"Objectif de sécurité 2: Mise en œuvre d'un cadre de gouvernance de la sécurité numérique";"Gestion de la conformité";"EntiteImportante, EntiteEssentielle";"élevé";"En application de la directive NIS 2, les organisations doivent mettre en œuvre les obligations en matière de gestion des risques sur l'ensemble de leurs systèmes d'information. Dans le cas de l'ISO 27001, l'application des mesures de gestion des risques concerne prioritairement les systèmes d'information considérés dans le domaine d'application du système de management de la sécurité de l'information (SMSI).
Ainsi, une organisation ayant décidé d'instaurer un SMSI sur un domaine d'application ne couvrant pas l'ensemble de ses systèmes d'information devra, dans le cadre de la mise en œuvre de NIS 2, également s'intéresser à ses systèmes d'information qui ne rentreraient pas dans ce domaine d'application.";"27002:2022-5.36 Conformité aux politiques, règles et normes de sécurité de l'information";"5.36 Conformité aux politiques, règles et normes de sécurité de l'information";;;;;;;;;;;;
"2.C.2-EI/EE";"L’entité établit, met en œuvre et suit dans la durée un plan d’action adapté à la structure et à l’environnement dans lequel elle opère afin de corriger ces écarts dans les meilleurs délais.
La responsabilité de ce plan d’action est déterminée au regard du cadre de gouvernance de la sécurité numérique mis en place.
Ce plan d’action prévoit, au minimum, une échéance raisonnable au regard du besoin de sécurisation du système d’information et un responsable pour la réalisation de chaque action.
Ce plan d’action ne préjuge pas de l’appréciation du respect de ses obligations légales et réglementaires lors d’un contrôle de l’ANSSI.";"Objectif de sécurité 2: Mise en œuvre d'un cadre de gouvernance de la sécurité numérique";"Gestion de la conformité";"EntiteImportante, EntiteEssentielle";"élevé";;"27002:2022-5.36 Conformité aux politiques, règles et normes de sécurité de l'information";"5.36 Conformité aux politiques, règles et normes de sécurité de l'information";;;;;;;;;;;;
"2.C.3-EI/EE";"Lorsque l’entité n’est pas tenue de mettre en œuvre le référentiel mais qu’elle décide de l’appliquer pour démontrer sa conformité aux objectifs de sécurité, et qu’elle applique une ou plusieurs mesures alternatives aux moyens acceptables de conformité du référentiel, elle en précise les justifications dans son analyse de la conformité. L’ANSSI peut apprécier la pertinence de la mesure retenue pour satisfaire la mesure du référentiel non retenue lors d’un contrôle.";"Objectif de sécurité 2: Mise en œuvre d'un cadre de gouvernance de la sécurité numérique";"Gestion de la conformité";"EntiteImportante, EntiteEssentielle";"faible";"Dans les termes actuels de la transposition nationale de NIS 2, les entités importantes comme essentielles ne sont pas tenues d'appliquer le référentiel NIS 2, bien que sa mise en œuvre permette à ces entités de s'en prévaloir auprès de l'ANSSI en cas de contrôle.
Ainsi, ces entités, dans le cadre de leur analyse de la conformité, précisent les mesures applicables (non issues du référentiel NIS 2) leur permettant de se conformer aux objectifs prévus dans la transposition nationale.";;;;;;;;;;;;;;
"3.A.1-EI/EE";"L’entité définit et maintient à jour une cartographie de l’écosystème dans lequel ses systèmes d’information sont mis en œuvre et contenant, au minimum, les informations suivantes :
•	La liste des prestataires et fournisseurs informatiques contribuant à la réalisation des activités ou des services de l’entité et avec lesquels il existe une relation de droit ou de fait (par exemple : prestataire d’infogérance, matériels et services fournis par la maison mère à une filiale, fournisseur de matériel informatique)
•	La liste des interconnexions avec les systèmes d’information de l’entité.
(Cette liste peut s’appuyer sur les démarches déjà réalisées par l’entité pour réaliser une telle liste. Par exemple, la déclaration de sous-traitance réalisée dans le cadre d’un contrat de la commande publique).";"Objectif de sécurité 3: Maîtrise de l'écosystème";"Cartographie de l'écosystème";"EntiteImportante, EntiteEssentielle";"moyen";"Ni la norme ISO 27001, ni la norme 27002 ne prévoit explicitement la réalisation d'une cartographie de l'écosystème. Cependant, si l'organisation décide de recourir à la norme ISO 27005 ou la méthodologie EBIOS Risk Manager pour réaliser l'analyse de risques que l'ISO 27001 lui impose, alors l'organisation sera amenée à constituer une cartographie de son écosystème.";"27001:2022-6.1.2 Appréciation des risques de sécurité de l'information";"6.1.2 Appréciation des risques de sécurité de l'information";"27001:2022-8.2 Appréciation des risques de sécurité de l'information";"8.2 Appréciation des risques de sécurité de l'information";"27002:2022-5.19 Sécurité de l'information dans les relations avec les fournisseurs";"5.19 Sécurité de l'information dans les relations avec les fournisseurs";"27002:2022-5.20 La sécurité de l'information dans les accords conclus avec les fournisseurs";"5.20 La sécurité de l'information dans les accords conclus avec les fournisseurs";;;;;;
"3.A.2-EI/EE";"L’entité renseigne et maintient à jour les coordonnées d’au moins un point de contact pour chaque entrée figurant dans la cartographie de l’écosystème.";"Objectif de sécurité 3: Maîtrise de l'écosystème";"Cartographie de l'écosystème";"EntiteImportante, EntiteEssentielle";"faible";"Ni la norme ISO 27001, ni la norme 27002 ne demande le recueil et le maintien à jour des coordonnées de point de contact pour chaque acteur constituant l'écosystème de l'organisation.";;;;;;;;;;;;;;
"3.B.1-EI/EE";"En cas de recours à un prestataire ou à un fournisseur informatique, l’entité s’assure que la prestation est conforme aux obligations auxquelles l’entité est assujettie, notamment en matière de gestion des risques qui menacent la sécurité de leurs réseaux et systèmes d’information et de notification des incidents importants et s’assure de disposer des assurances contractuelles de cette conformité (par exemple : plan d’assurance sécurité, charte de télémaintenance, mise en place d’indicateurs de suivi de la conformité).";"Objectif de sécurité 3: Maîtrise de l'écosystème";"Sécurité numérique dans les contrats avec les prestataires et fournisseurs informatiques";"EntiteImportante, EntiteEssentielle";"élevé";;"27002:2022-5.19 Sécurité de l'information dans les relations avec les fournisseurs";"5.19 Sécurité de l'information dans les relations avec les fournisseurs";"27002:2022-5.20 La sécurité de l'information dans les accords conclus avec les fournisseurs";"5.20 La sécurité de l'information dans les accords conclus avec les fournisseurs";"27002:2022-5.21 Gestion de la sécurité de l'information dans la chaîne d'approvisionnement TIC";"5.21 Gestion de la sécurité de l'information dans la chaîne d'approvisionnement TIC";;;;;;;;
"3.B.2-EI/EE";"L'entité vérifie périodiquement la conformité de la prestation aux obligations auxquelles l’entité est assujettie notamment en matière de gestion des risques qui menacent la sécurité de leurs réseaux et systèmes d’information et de notification des incidents importants. L’entité peut s’appuyer sur des audits dont les conditions sont précisées par les Moyens acceptables de conformité 17.2-EE, 17.4-EE et 17.5-EE relatifs à l’audit.";"Objectif de sécurité 3: Maîtrise de l'écosystème";"Sécurité numérique dans les contrats avec les prestataires et fournisseurs informatiques";"EntiteImportante, EntiteEssentielle";"élevé";;"27002:2022-5.22 Surveillance, révision et gestion des changements des services fournisseurs";"5.22 Surveillance, révision et gestion des changements des services fournisseurs";;;;;;;;;;;;
"4.1-EI/EE";"L'entité définit et met en œuvre une charte d'usage des systèmes d'information, et la rend opposable à chacun des utilisateurs de ces systèmes d'information.
Cette charte peut prévoir des dispositions spécifiques pour les administrateurs.
Cette charte peut également couvrir les systèmes d'information pour lesquels l'entité a décidé de ne pas appliquer les objectifs de sécurité.";"Objectif de sécurité 4: Prise en compte de la sécurité numérique dans la gestion des ressources humaines";"Sécurité des ressources humaines";"EntiteImportante, EntiteEssentielle";"moyen";"Les normes ISO 27001 et ISO 27002 prévoient plusieurs mesures sur la sensibilisation des utilisateurs des SI et l'utilisation correcte des informations et autres actifs associés, mais pas sur l'adoption d'une charte d'usage des SI. ";"27001:2022-7.3 Sensibilisation";"7.3 Sensibilisation";"27002:2022-5.10 Utilisation correcte des informations et autres actifs associés";"5.10 Utilisation correcte des informations et autres actifs associés";"27002:2022-6.2 Termes et conditions du contrat de travail";"6.2 Termes et conditions du contrat de travail";"27002:2022-6.3 Sensibilisation, enseignement et formation en sécurité de l'information";"6.3 Sensibilisation, enseignement et formation en sécurité de l'information";;;;;;
"4.2-EI/EE";"L’entité définit et met en œuvre un programme de sensibilisation à la sécurité numérique de l’ensemble des utilisateurs.
Ce programme doit comporter des actions tout au long de la présence des utilisateurs dans l’entité.";"Objectif de sécurité 4: Prise en compte de la sécurité numérique dans la gestion des ressources humaines";"Sécurité des ressources humaines";"EntiteImportante, EntiteEssentielle";"élevé";;"27001:2022-7.3 Sensibilisation";"7.3 Sensibilisation";"27002:2022-6.3 Sensibilisation, enseignement et formation en sécurité de l'information";"6.3 Sensibilisation, enseignement et formation en sécurité de l'information";;;;;;;;;;
"4.3-EE";"L’entité prévoit des clauses de sécurité dans ses contrats de travail (par exemple : clauses de confidentialité de nature à garantir la confidentialité des informations auxquelles les salariés ont accès au cours de leur contrat et à l’issu de celui-ci).";"Objectif de sécurité 4: Prise en compte de la sécurité numérique dans la gestion des ressources humaines";"Sécurité des ressources humaines";"EntiteEssentielle";"élevé";;"27002:2022-6.2 Termes et conditions du contrat de travail";"6.2 Termes et conditions du contrat de travail";"27002:2022-6.6 Accords de confidentialité ou de non-divulgation";"6.6 Accords de confidentialité ou de non-divulgation";;;;;;;;;;
"4.4-EI/EE";"L’entité définit et met en œuvre un processus de gestion des arrivées, des départs et des changements de fonction des personnels et des tiers accédant aux systèmes d’information. Ce processus prévoit :
•	La prise de connaissance des règles de sécurité en vigueur lors leur arrivée ;
•	L’attribution des accès appropriés lors de leur arrivée ;
•	La mise à jour des accès lors d’un changement de fonction ;
•	Lors du départ, la restitution de l’ensemble du matériel qui a été mis à disposition et la désactivation de l’ensemble des accès logiques aux systèmes d’information et physiques aux locaux et salles.";"Objectif de sécurité 4: Prise en compte de la sécurité numérique dans la gestion des ressources humaines";"Sécurité des ressources humaines";"EntiteImportante, EntiteEssentielle";"élevé";"Les normes ISO 27001 et ISO 27002 prévoient diverses mesures permettant de limiter les risques liés au départ d'un collaborateur, mais n'imposent pas la mise en place d'un processus global de gestion des arrivées et départs dans l'organisation au sein duquel l'ensemble de ces préoccupations seraient traitées.";"27001:2022-7.3 Sensibilisation";"7.3 Sensibilisation";"27002:2022-5.11 Restitution des actifs";"5.11 Restitution des actifs";"27002:2022-5.16 Gestion des identités";"5.16 Gestion des identités";"27002:2022-5.17 Informations d'authentification";"5.17 Informations d'authentification";"27002:2022-5.18 Droits d'accès";"5.18 Droits d'accès";"27002:2022-6.5 Responsabilités après la fin ou le changement d’un emploi";"6.5 Responsabilités après la fin ou le changement d’un emploi";;
"4.5-EI/EE";"L’entité définit et met en œuvre, pour les fonctions assumant des responsabilités dans le domaine du numérique, un programme de formations dédiées à la sécurité numérique adapté à leurs responsabilités.";"Objectif de sécurité 4: Prise en compte de la sécurité numérique dans la gestion des ressources humaines";"Sécurité des ressources humaines";"EntiteImportante, EntiteEssentielle";"élevé";;"27001:2022-7.2 Compétences";"7.2 Compétences";"27001:2022-7.3 Sensibilisation";"7.3 Sensibilisation";"27002:2022-6.3 Sensibilisation, enseignement et formation en sécurité de l'information";"6.3 Sensibilisation, enseignement et formation en sécurité de l'information";;;;;;;;
"5.A.1-EI/EE";"L’entité élabore et maintient à jour au moins une cartographie de ses systèmes d’information dont le niveau de détail est suffisant pour lui permettre :
o	d’assurer le maintien en condition opérationnelles et de sécurité de ces systèmes (par exemple : être capable d’identifier les ressources matérielles ou logicielles vulnérables suite à la publication d’un bulletin d’alerte) ;
o	de pouvoir réagir sans retard injustifié à un incident de sécurité affectant ces systèmes d’information (par exemple : être capable d’identifier les ressources matérielles ou logicielles affectées par un incident de sécurité et ainsi limiter les conséquences de l’incident).
Cette cartographie peut s’appuyer sur les recommandations de l’autorité nationale de sécurité des systèmes d’information en matière de cartographie.";"Objectif de sécurité 5: Maitrise des systèmes d'information";"Cartographie des systèmes d'information";"EntiteImportante, EntiteEssentielle";"élevé";;"27002:2022-5.9 Inventaire des informations et autres actifs associés";"5.9 Inventaire des informations et autres actifs associés";;;;;;;;;;;;
"5.B.1-EE";"L’entité élabore, met en œuvre et maintient à jour une procédure de maintien en conditions opérationnelle et de sécurité des ressources matérielles et logicielles de ses systèmes d’information.";"Objectif de sécurité 5: Maitrise des systèmes d'information";"Maintien en condition opérationnelle et de sécurité";;"élevé";"Les normes ISO 27001 et ISO 27002 prévoient diverses mesures contribuant au maintien en condition opérationnelle et de sécurité mais n'imposent pas la mise en place d'un processus global.
";"27002:2022-5.37 Procédures d'exploitation documentées";"5.37 Procédures d'exploitation documentées";"27002:2022-8.8 Gestion des vulnérabilités techniques";"8.8 Gestion des vulnérabilités techniques";"27002:2022-8.9 Gestion des configurations";"8.9 Gestion des configurations";;;;;;;;
"5.B.2-EI/EE";"L’entité maintient à jour les bases de connaissances des outils de protection contre les codes malveillants qu’elle utilise (par exemple : la mise à jour de la base antivirale de l’antivirus, la mise à jour des signatures utilisées par la solution d’EDR).";"Objectif de sécurité 5: Maitrise des systèmes d'information";"Maintien en condition opérationnelle et de sécurité";;"élevé";;"27002:2022-8.7 Protection contre les programmes malveillants (malware)";"8.7 Protection contre les programmes malveillants (malware)";;;;;;;;;;;;
