"Référence";"Contenu";"Objectif";"Thématique";"Cibles";"Correspondance";"Observations";"Référence ISO (1)";"Contenu ISO (1)";"Référence ISO (2)";"Contenu ISO (2)";"Référence ISO (3)";"Contenu ISO (3)";"Référence ISO (4)";"Contenu ISO (4)";"Référence ISO (5)";"Contenu ISO (5)";"Référence ISO (6)";"Contenu ISO (6)";"Référence ISO (7)";"Contenu ISO (7)"
"5.B.3-EI/EE";"L’entité met en œuvre une veille sur les vulnérabilités, les correctifs de sécurité et les mesures d’atténuation préconisées susceptibles de concerner les ressources de ses systèmes d’information, qui sont diffusées notamment par les fournisseurs ou les fabricants de ces ressources, par un prestataire mandaté ou par des centres de prévention et d’alerte en matière de cyber sécurité tels que le CERT-FR (centre gouvernemental de veille, d’alerte et de réponse aux attaques informatiques) ou les CSIRT (centres de réponse aux incidents de sécurité informatique).";"Objectif de sécurité 5: Maitrise des systèmes d'information";"Maintien en condition opérationnelle et de sécurité";;"élevé";;"27002:2022-5.7 Renseignements sur les menaces";"5.7 Renseignements sur les menaces";"27002:2022-8.8 Gestion des vulnérabilités techniques";"8.8 Gestion des vulnérabilités techniques";;;;;;;;;;
"5.B.4-EI/EE";"L’entité met en œuvre, au regard de la nature de la vulnérabilité :
•	sans délai : les actions visant à l’installation des correctifs de sécurité (par exemple : le déploiement en environnement de test, pré-production et production, mécanismes de rollback) ;
•	sans retard injustifié : l’application effective des correctifs de sécurité après la réalisation des actions précédentes
sur les ressources exposées à des systèmes d’information tiers (par exemple : un serveur Web, un pare-feu exposé sur Internet, un serveur de messagerie) et les postes de travail des utilisateurs.";"Objectif de sécurité 5: Maitrise des systèmes d'information";"Maintien en condition opérationnelle et de sécurité";"EntiteImportante, EntiteEssentielle";"élevé";;"27002:2022-8.8 Gestion des vulnérabilités techniques";"8.8 Gestion des vulnérabilités techniques";;;;;;;;;;;;
"5.B.5-EE";"L’entité planifie et installe sur l’ensemble de ses ressources, y compris celles non exposées à des systèmes d’information tiers, les correctifs de sécurité.";"Objectif de sécurité 5: Maitrise des systèmes d'information";"Maintien en condition opérationnelle et de sécurité";"EntiteEssentielle";"élevé";;"27002:2022-8.8 Gestion des vulnérabilités techniques";"8.8 Gestion des vulnérabilités techniques";;;;;;;;;;;;
"5.B.6-EI/EE";"Lorsque des raisons techniques ou opérationnelles ne permettent pas l’installation des correctifs de sécurité sur les ressources concernées, l’entité met en œuvre des mesures d’atténuation pour réduire les risques liés à l’utilisation d’une version comportant des vulnérabilités connues (par exemple : isoler la ressource du reste du SI, mettre en place un contrôle d'accès renforcé).";"Objectif de sécurité 5: Maitrise des systèmes d'information";"Maintien en condition opérationnelle et de sécurité";"EntiteImportante, EntiteEssentielle";"élevé";;"27001:2022-6.1.2 Appréciation des risques de sécurité de l'information";"6.1.2 Appréciation des risques de sécurité de l'information";"27001:2022-6.1.3 Traitement des risques de sécurité de l'information";"6.1.3 Traitement des risques de sécurité de l'information";"27001:2022-8.2 Appréciation des risques de sécurité de l'information";"8.2 Appréciation des risques de sécurité de l'information";"27001:2022-8.3 Traitement des risques de sécurité de l'information";"8.3 Traitement des risques de sécurité de l'information";;;;;;
"5.B.7-EI/EE";"L’entité met en œuvre sans délai les actions visant à l’installation et le maintien à jour des ressources logicielles de ses systèmes d’information, y compris les logiciels embarqués, dans des versions bénéficiant d’un support par leurs fournisseurs ou leurs fabricants et comportant les mises à jour de sécurité.";"Objectif de sécurité 5: Maitrise des systèmes d'information";"Maintien en condition opérationnelle et de sécurité";"EntiteImportante, EntiteEssentielle";"élevé";;"27002:2022-8.8 Gestion des vulnérabilités techniques";"8.8 Gestion des vulnérabilités techniques";"27002:2022-8.19 Installation de logiciels sur des systèmes opérationnels";"8.19 Installation de logiciels sur des systèmes opérationnels";;;;;;;;;;
"5.B.8-EI/EE";"L’entité vérifie que toute nouvelle version d’un logiciel est téléchargée depuis les ressources officielles mises à disposition par les éditeurs ou les fournisseurs.";"Objectif de sécurité 5: Maitrise des systèmes d'information";"Maintien en condition opérationnelle et de sécurité";"EntiteImportante, EntiteEssentielle";"élevé";;"27002:2022-8.8 Gestion des vulnérabilités techniques";"8.8 Gestion des vulnérabilités techniques";"27002:2022-8.19 Installation de logiciels sur des systèmes opérationnels";"8.19 Installation de logiciels sur des systèmes opérationnels";;;;;;;;;;
"5.B.9-EI/EE";"Lorsque des raisons techniques ou opérationnelles ne permettent pas l’installation d’une version supportée par le fournisseur ou l’éditeur, l’entité met en œuvre des mesures pour réduire les risques liés à l’utilisation d’une version obsolète.";"Objectif de sécurité 5: Maitrise des systèmes d'information";"Maintien en condition opérationnelle et de sécurité";"EntiteImportante, EntiteEssentielle";"élevé";;"27001:2022-6.1.2 Appréciation des risques de sécurité de l'information";"6.1.2 Appréciation des risques de sécurité de l'information";"27001:2022-6.1.3 Traitement des risques de sécurité de l'information";"6.1.3 Traitement des risques de sécurité de l'information";"27001:2022-8.2 Appréciation des risques de sécurité de l'information";"8.2 Appréciation des risques de sécurité de l'information";"27001:2022-8.3 Traitement des risques de sécurité de l'information";"8.3 Traitement des risques de sécurité de l'information";;;;;;
"6.1-EI/EE";"L’entité met en place des mesures de sécurité permettant de limiter l’accès de personnes non autorisées à ses locaux, ses salles serveurs et ses locaux techniques (par exemple : tenue d’un registre des visiteurs, badges d’accès, etc).";"Objectif de sécurité 6: Maitrise des accès physiques aux locaux";"Maîtrise des accès physiques";"EntiteImportante, EntiteEssentielle";"élevé";;"27002:2022-7.1 Périmètres de sécurité physique";"7.1 Périmètres de sécurité physique";"27002:2022-7.2 Les entrées physiques";"7.2 Les entrées physiques";"27002:2022-7.3 Sécurisation des bureaux, des salles et des installations";"7.3 Sécurisation des bureaux, des salles et des installations";"27002:2022-7.4 Surveillance de la sécurité physique";"7.4 Surveillance de la sécurité physique";"27002:2022-7.6 Travail dans les zones sécurisées";"7.6 Travail dans les zones sécurisées";;;;
"6.2-EE";"L’entité s’assure de la protection physique des locaux, salles serveurs et locaux techniques (par exemple : vidéosurveillance, gardiennage, alarme).
Cette protection physique permet de prévenir, de surveiller et de réagir aux accès non autorisés à ces locaux.";"Objectif de sécurité 6: Maitrise des accès physiques aux locaux";"Maîtrise des accès physiques";"EntiteEssentielle";"élevé";;"27002:2022-7.1 Périmètres de sécurité physique";"7.1 Périmètres de sécurité physique";"27002:2022-7.2 Les entrées physiques";"7.2 Les entrées physiques";"27002:2022-7.3 Sécurisation des bureaux, des salles et des installations";"7.3 Sécurisation des bureaux, des salles et des installations";"27002:2022-7.4 Surveillance de la sécurité physique";"7.4 Surveillance de la sécurité physique";"27002:2022-7.6 Travail dans les zones sécurisées";"7.6 Travail dans les zones sécurisées";"27002:2022-7.7 Bureau vide et écran vide";"7.7 Bureau vide et écran vide";"27002:2022-7.8 Emplacement et protection du matériel";"7.8 Emplacement et protection du matériel"
"6.3-EE";"L’entité s’assure que les droits d'accès physique sont attribués au regard du besoin strictement nécessaire à l’exécution des missions des personnes.";"Objectif de sécurité 6: Maitrise des accès physiques aux locaux";"Maîtrise des accès physiques";"EntiteEssentielle";"élevé";;"27002:2022-5.15 Contrôle d'accès";"5.15 Contrôle d'accès";"27002:2022-7.2 Les entrées physiques";"7.2 Les entrées physiques";"27002:2022-7.3 Sécurisation des bureaux, des salles et des installations";"7.3 Sécurisation des bureaux, des salles et des installations";"27002:2022-7.4 Surveillance de la sécurité physique";"7.4 Surveillance de la sécurité physique";;;;;;
"6.4-EI/EE";"L'entité s'assure que les personnes externes accédant aux locaux techniques et salles serveurs de l’entité sont accompagnées ou dûment autorisées.";"Objectif de sécurité 6: Maitrise des accès physiques aux locaux";"Maîtrise des accès physiques";"EntiteImportante, EntiteEssentielle";"élevé";;"27002:2022-7.2 Les entrées physiques";"7.2 Les entrées physiques";;;;;;;;;;;;
"7.A.1-EI/EE";"L’entité cloisonne physiquement et/ou logiquement l’ensemble de ses systèmes d’information vis-à-vis des autres systèmes d’information, y compris des systèmes d’information pour lesquels elle a décidé de ne pas appliquer les objectifs de sécurité et les systèmes d’information tiers (par exemple : cloisonnement logique par VLAN – réseau local virtuel - (réseau), par VM – machine virtuelle - (calcul) ou par volume (stockage)).";"Objectif de sécurité 7: Sécurisation de l'architecture des systèmes d'information";"Cloisonnement";"EntiteImportante, EntiteEssentielle";"élevé";;"27002:2022-8.20 Sécurité des réseaux";"8.20 Sécurité des réseaux";"27002:2022-8.22 Cloisonnement des réseaux";"8.22 Cloisonnement des réseaux";"27002:2022-8.27 Principes d'ingénierie et d'architecture des système sécurisés";"8.27 Principes d'ingénierie et d'architecture des système sécurisés";;;;;;;;
"7.A.2-EE";"L’entité cloisonne physiquement et/ou logiquement chaque système d’information vis-à-vis des autres systèmes d’information, y compris des systèmes d’information pour lesquels elle a décidé de ne pas appliquer les objectifs de sécurité et des systèmes d’information tiers (par exemple : un système d’information est cloisonné logiquement des autres systèmes d’information de l’entité. Il est aussi cloisonné physiquement des systèmes d’information de l’entité pour lesquels elle a décidé de ne pas appliquer les objectifs de sécurité).";"Objectif de sécurité 7: Sécurisation de l'architecture des systèmes d'information";"Cloisonnement";"EntiteEssentielle";"élevé";;"27002:2022-8.22 Cloisonnement des réseaux";"8.22 Cloisonnement des réseaux";;;;;;;;;;;;
"7.A.3-EE";"L’entité mène des réflexions, pour chaque système d’information, sur la pertinence de définir des sous-systèmes. Lorsqu’elle n’identifie aucun sous-système, l’entité en apporte la justification.
Un sous-système regroupe des ressources assurant des fonctionnalités similaires et ayant des niveaux de sensibilité, d’exposition et de sécurité homogènes.";"Objectif de sécurité 7: Sécurisation de l'architecture des systèmes d'information";"Cloisonnement";"EntiteEssentielle";"élevé";;"27002:2022-8.20 Sécurité des réseaux";"8.20 Sécurité des réseaux";"27002:2022-8.22 Cloisonnement des réseaux";"8.22 Cloisonnement des réseaux";"27002:2022-8.27 Principes d'ingénierie et d'architecture des système sécurisés";"8.27 Principes d'ingénierie et d'architecture des système sécurisés";;;;;;;;
"7.A.4-EE";"Les sous-systèmes identifiés à la mesure 7.A.4-EE sont cloisonnés entre eux physiquement et/ou logiquement.";"Objectif de sécurité 7: Sécurisation de l'architecture des systèmes d'information";"Cloisonnement";"EntiteEssentielle";"élevé";;"27002:2022-8.20 Sécurité des réseaux";"8.20 Sécurité des réseaux";"27002:2022-8.22 Cloisonnement des réseaux";"8.22 Cloisonnement des réseaux";"27002:2022-8.27 Principes d'ingénierie et d'architecture des système sécurisés";"8.27 Principes d'ingénierie et d'architecture des système sécurisés";;;;;;;;
"7.A.5-EE";"L’entité met en œuvre au moins un sous-système “passerelle sortante” permettant :
•	aux ressources de ses systèmes d’information d’accéder aux systèmes d’informations tiers ;
•	d’authentifier, de filtrer et de tracer les accès aux systèmes d’information tiers (par exemple : un serveur mandataire).";"Objectif de sécurité 7: Sécurisation de l'architecture des systèmes d'information";"Cloisonnement";"EntiteEssentielle";"élevé";;"27002:2022-8.20 Sécurité des réseaux";"8.20 Sécurité des réseaux";"27002:2022-8.22 Cloisonnement des réseaux";"8.22 Cloisonnement des réseaux";"27002:2022-8.27 Principes d'ingénierie et d'architecture des système sécurisés";"8.27 Principes d'ingénierie et d'architecture des système sécurisés";;;;;;;;
"7.A.6-EE";"L’entité met en œuvre au moins un sous-système “passerelle entrante” permettant :
•	d’exposer des ressources de ses systèmes d’information aux systèmes d’information tiers ;
•	de filtrer et de tracer les accès depuis des systèmes d’information tiers (par exemple : un serveur mandataire inverse ou un relai).";"Objectif de sécurité 7: Sécurisation de l'architecture des systèmes d'information";"Cloisonnement";"EntiteEssentielle";"élevé";;"27002:2022-8.20 Sécurité des réseaux";"8.20 Sécurité des réseaux";"27002:2022-8.22 Cloisonnement des réseaux";"8.22 Cloisonnement des réseaux";"27002:2022-8.27 Principes d'ingénierie et d'architecture des système sécurisés";"8.27 Principes d'ingénierie et d'architecture des système sécurisés";;;;;;;;
"7.A.7-EI/EE";"Seules les interconnexions nécessaires à la réalisation des activités et services de l’entité ou au maintien en condition opérationnelle ou de sécurité sont mises en œuvre entre l’ensemble des systèmes d’information et, d’une part les systèmes d’information tiers et, d’autre part les autres systèmes d’information sous la responsabilité de l’entité pour lesquels elle a décidé de ne pas appliquer les objectifs de sécurité.";"Objectif de sécurité 7: Sécurisation de l'architecture des systèmes d'information";"Cloisonnement";"EntiteImportante, EntiteEssentielle";"élevé";;"27002:2022-8.20 Sécurité des réseaux";"8.20 Sécurité des réseaux";"27002:2022-8.21 Sécurité des services réseau";"8.21 Sécurité des services réseau";"27002:2022-8.22 Cloisonnement des réseaux";"8.22 Cloisonnement des réseaux";"27002:2022-8.27 Principes d'ingénierie et d'architecture des système sécurisés";"8.27 Principes d'ingénierie et d'architecture des système sécurisés";;;;;;
"7.A.8-EE";"Seules les interconnexions nécessaires à la réalisation des activités et services de l’entité ou au maintien en condition opérationnelle ou de sécurité sont mises en œuvre entre chaque système d’information et, d’une part les systèmes d’information tiers et, d’autre part les autres systèmes d’information sous la responsabilité de l’entité pour lesquels elle a décidé de ne pas appliquer les objectifs de sécurité, ou entre les sous-systèmes du système d’information.";"Objectif de sécurité 7: Sécurisation de l'architecture des systèmes d'information";"Cloisonnement";"EntiteEssentielle";"élevé";;"27002:2022-8.20 Sécurité des réseaux";"8.20 Sécurité des réseaux";"27002:2022-8.21 Sécurité des services réseau";"8.21 Sécurité des services réseau";"27002:2022-8.22 Cloisonnement des réseaux";"8.22 Cloisonnement des réseaux";"27002:2022-8.27 Principes d'ingénierie et d'architecture des système sécurisés";"8.27 Principes d'ingénierie et d'architecture des système sécurisés";;;;;;
"7.B.1-EI/EE";"L’entité définit et documente les communications nécessaires :
•	à la réalisation de ses activités et services ;
•	au maintien en condition opérationnelle de sécurité circulant entre ses systèmes d’information et les autres systèmes d’information pour lesquels elle a décidé de ne pas appliquer les objectifs de sécurité, d’une part, et les systèmes d’information tiers, d’autre part.";"Objectif de sécurité 7: Sécurisation de l'architecture des systèmes d'information";"Filtrage des communications";"EntiteImportante, EntiteEssentielle";"élevé";;"27002:2022-8.2 Droits d'accès privilégiés";"8.2 Droits d'accès privilégiés";"27002:2022-8.12 Prévention de la fuite de données";"8.12 Prévention de la fuite de données";"27002:2022-8.18 Utilisation de programmes utilitaires à privilèges";"8.18 Utilisation de programmes utilitaires à privilèges";"27002:2022-8.20 Sécurité des réseaux";"8.20 Sécurité des réseaux";"27002:2022-8.21 Sécurité des services réseau";"8.21 Sécurité des services réseau";"27002:2022-8.22 Cloisonnement des réseaux";"8.22 Cloisonnement des réseaux";"27002:2022-8.27 Principes d'ingénierie et d'architecture des système sécurisés";"8.27 Principes d'ingénierie et d'architecture des système sécurisés"
"7.B.2-EE";"L’entité définit et documente les communications nécessaires au maintien en condition opérationnelle de sécurité circulant entre les sous-systèmes du système d’information.";"Objectif de sécurité 7: Sécurisation de l'architecture des systèmes d'information";"Filtrage des communications";"EntiteEssentielle";"élevé";;"27002:2022-8.2 Droits d'accès privilégiés";"8.2 Droits d'accès privilégiés";"27002:2022-8.12 Prévention de la fuite de données";"8.12 Prévention de la fuite de données";"27002:2022-8.18 Utilisation de programmes utilitaires à privilèges";"8.18 Utilisation de programmes utilitaires à privilèges";"27002:2022-8.20 Sécurité des réseaux";"8.20 Sécurité des réseaux";"27002:2022-8.21 Sécurité des services réseau";"8.21 Sécurité des services réseau";"27002:2022-8.27 Principes d'ingénierie et d'architecture des système sécurisés";"8.27 Principes d'ingénierie et d'architecture des système sécurisés";;
"7.B.3-EI/EE";"L’entité met en œuvre, au niveau des interconnexions, les règles de filtrage pour n’autoriser que les communications identifiées à la mesure 7.B.1-EI/EE ou 7.B.2-EE. Les autres communications sont bloquées par défaut.";"Objectif de sécurité 7: Sécurisation de l'architecture des systèmes d'information";"Filtrage des communications";"EntiteImportante, EntiteEssentielle";"moyen";"La norme ISO 27002 prévoit de nombreuses mesures relatives à la sécurité des réseaux mais pas explicitement l'application d'une politique de restriction par défaut de l'ensemble des communications et l'autorisation uniquement des communications nécessaires à la réalisation des activités de l'organisation.";"27002:2022-8.12 Prévention de la fuite de données";"8.12 Prévention de la fuite de données";"27002:2022-8.20 Sécurité des réseaux";"8.20 Sécurité des réseaux";"27002:2022-8.21 Sécurité des services réseau";"8.21 Sécurité des services réseau";"27002:2022-8.27 Principes d'ingénierie et d'architecture des système sécurisés";"8.27 Principes d'ingénierie et d'architecture des système sécurisés";;;;;;
"7.B.4-EI/EE";"L’entité filtre par un ou plusieurs pares-feux dédiés à cet usage, au minimum :
•	les communications entre les systèmes d’information de l’entité pour lesquels elle a décidé d'appliquer les objectifs ou non, d’une part ; et
•	les SI tiers d’autre part.
Par exemple : une entité mettant en œuvre un pare-feu pour filtrer les communications entre ses systèmes d’information (pour lesquels elle applique les objectifs de sécurité ou non) d’une part et les systèmes d’information tiers d’autre part est une solution acceptable.";"Objectif de sécurité 7: Sécurisation de l'architecture des systèmes d'information";"Filtrage des communications";"EntiteImportante, EntiteEssentielle";"moyen";"La norme ISO 27002 prévoit de nombreuses mesures relatives à la sécurité des réseaux mais ne donne pas de détail sur le cloisonnement que l'organisation doit effectivement mettre en place. En l'occurrence, le référentiel NIS 2 demande aux entités de cloisonner au minimum ses systèmes d'information des systèmes d'information tiers à l'aide de pare-feux (cloisonnement de bordure).
";"27002:2022-8.12 Prévention de la fuite de données";"8.12 Prévention de la fuite de données";"27002:2022-8.20 Sécurité des réseaux";"8.20 Sécurité des réseaux";"27002:2022-8.21 Sécurité des services réseau";"8.21 Sécurité des services réseau";"27002:2022-8.27 Principes d'ingénierie et d'architecture des système sécurisés";"8.27 Principes d'ingénierie et d'architecture des système sécurisés";;;;;;
"7.B.5-EI/EE";"L’entité effectue annuellement une revue de la mise en œuvre technique des règles de filtrage mentionnées à la mesure 7.B.4-EI/EE.";"Objectif de sécurité 7: Sécurisation de l'architecture des systèmes d'information";"Filtrage des communications";"EntiteImportante, EntiteEssentielle";"moyen";"Les normes ISO 27001 et ISO 27002 prévoient de nombreuses mesures visant à vérifier l'efficacité des mesures de sécurité mises en œuvre mais ne prévoient pas explicitement la revue annuelle des règles de filtrage.";"27002:2022-8.12 Prévention de la fuite de données";"8.12 Prévention de la fuite de données";"27002:2022-8.20 Sécurité des réseaux";"8.20 Sécurité des réseaux";"27002:2022-8.21 Sécurité des services réseau";"8.21 Sécurité des services réseau";"27002:2022-8.27 Principes d'ingénierie et d'architecture des système sécurisés";"8.27 Principes d'ingénierie et d'architecture des système sécurisés";;;;;;
"8.1-EI/EE";"L’entité protège les accès à ses systèmes d’information effectués à travers un système d’information tiers au moyen de mécanismes de chiffrement conformes aux recommandations de l’autorité nationale de sécurité des systèmes d’information (par exemple : VPN TLS ou IPSec, protocoles applicatifs chiffrés comme TLS, SSH, etc.).";"Objectif de sécurité 8: Sécurisation des accès distants aux systèmes d'information";"Sécurisation des accès distants";"EntiteImportante, EntiteEssentielle";"moyen";"Les mesures prévues par la norme ISO 27002 en matière d'accès distants couvrent les accès distants des employés mais pas des prestataires qui accèderaient également à distance aux SI (par exemple : le cas de l'infogérance).
Par ailleurs, bien que la norme ISO 27002 prévoit des mesures de sécurisation des accès distants, le référentiel NIS 2 va au-delà en prévoyant que les mécanismes de chiffrement mis en œuvre respectent les recommandations de l'ANSSI.
";"27002:2022-6.7 Travail à distance";"6.7 Travail à distance";"27002:2022-8.24 Utilisation de la cryptographie";"8.24 Utilisation de la cryptographie";;;;;;;;;;
"8.2-EI/EE";"Lorsque les accès visés à la mesure 8.2-EI/EE sont effectués par les personnels et prestataires qu’elle a autorisée, l’entité protège les accès aux systèmes d’information par un mécanisme d'authentification conforme aux mesures relatives à l’Authentification.";"Objectif de sécurité 8: Sécurisation des accès distants aux systèmes d'information";"Sécurisation des accès distants";"EntiteImportante, EntiteEssentielle";"moyen";"Les mesures prévues par la norme ISO 27002 en matière d'accès distants couvrent les accès distants des employés mais pas des prestataires qui accèderaient également à distance aux SI (par exemple : le cas de l'infogérance).
Par ailleurs, bien que la norme ISO 27002 prévoit des mesures de sécurisation des accès distants, le référentiel NIS 2 va au-delà en prévoyant que les mécanismes de chiffrement mis en œuvre respectent les recommandations de l'ANSSI.";"27002:2022-5.17 Informations d'authentification";"5.17 Informations d'authentification";"27002:2022-6.7 Travail à distance";"6.7 Travail à distance";"27002:2022-8.5 Authentification sécurisée";"8.5 Authentification sécurisée";;;;;;;;
"8.3-EE";"Pour les accès visés à la mesure 8.2-EI/EE le mécanisme d’authentification est multifacteur et repose sur au moins un facteur de connaissance (par exemple : authentification avec une carte à puce et un code PIN).";"Objectif de sécurité 8: Sécurisation des accès distants aux systèmes d'information";"Sécurisation des accès distants";"EntiteEssentielle";"moyen";"Les mesures prévues par la norme ISO 27002 en matière d'accès distants couvrent les accès distants des employés mais pas des prestataires qui accèderaient également à distance aux SI (par exemple : le cas de l'infogérance).";"27002:2022-6.7 Travail à distance";"6.7 Travail à distance";"27002:2022-8.5 Authentification sécurisée";"8.5 Authentification sécurisée";;;;;;;;;;
